論文名,提案モデル,発表年,発表場所,概要,リンク
AgentBreeder: Mitigating the AI Safety Risks of Multi-Agent Scaffolds via Self-Improvement,,2024,arXiv,近年の大規模言語モデル（LLMs）の発展に伴い、複数のLLMエージェントを組み合わせた「マルチエージェント・スキャフォールド（Multi-Agent Scaffolds）」の活用が急速に進んでいる。これらのシステムは、複雑なタスクにおける性能を単一エージェントよりも向上させる一方で、その「安全性（Safety）」に与える影響については十分に研究されてこなかった。従来のアライメント研究は主に単一LLMの安全性（Unipolarシナリオ）に焦点を当てていたが、自律型エージェントの普及により、複数のエージェントが相互作用するMulti-polarな環境下での安全性評価が急務となっている。本論文では、マルチエージェント・スキャフォールドの設計パラダイムにおける潜在的な脆弱性を明らかにし、安全性とタスク性能を両立したスキャフォールドを自動的に探索・生成するための進化的フレームワーク「AgentBreeder」を提案している。,./LLMと逐次改善/article_summaries/AgentBreeder: Mitigating the AI Safety Risks of Multi-Agent Scaffolds via Self-Improvement/summary.md
Automatic Prompt Optimization with “Gradient Descent” and Beam Search,,2024,arXiv,Large Language Models (LLMs) の性能は入力されるプロンプトに強く依存するが、手動でのプロンプト作成（Prompt Engineering）は多大な試行錯誤を要し、経験的な負担が大きい。既存のプロンプト最適化研究（AutoPromptやSoft Prompt Tuningなど）は、API経由で利用するブラックボックスなLLMには適用できない内部パラメータへのアクセスを前提としていることが多い。一方で、RLPrompt や TEMPERA といった手法は、強化学習やモンテカルロ探索を用いたランダムな離散操作（パラフレーズや単語の入れ替えなど）に依存しており、意味論的に「方向性を持った」最適化（directed optimization）が実現できていなかった。 本研究では、一般的なLLM APIのみを用いて、数値的な勾配降下法（Gradient Descent）のアナロジーを自然言語ベースの対話によって模倣する、シンプルかつ非パラメトリックなプロンプト自動最適化手法「ProTeGi (Prompt Optimization with Textual Gradients)」を提案している。,./LLMと逐次改善/article_summaries/Automatic Prompt Optimization with “Gradient Descent” and Beam Search/summary.md
Black box tuning for language model as a service,,2016,arXiv,大規模な事前学習済み言語モデル (PTMs) 、例えばGPT-3などは、非常に強力な一般化能力を持つ一方で、計算コストやパラメータの秘匿性（商業的理由や悪用リスク）から、それらをローカル環境で直接動かすことは難しく、APIサービス (Language-Model-as-a-Service: LMaaS) として提供されるのが一般的である。 このようなブラックボックスなAPI経由では、モデルの内部パラメータや勾配（Gradients）にアクセスすることができない。そのため、モデルの微調整（Fine-TuningやPrompt Tuningなど）を行う際に必須のバックプロパゲーションが使用できず、高い性能を発揮するタスク特化型のContinuous Prompt（連続値ベクトルによるプロンプト）の最適化は困難とされてきた。特にプロンプト空間は数万次元と高次元になるため、勾配情報を用いないDerivative-Free Optimization (DFO: 勾配フリー最適化) アルゴリズムを直接適用することは計算量的に非現実的であった。,./LLMと逐次改善/article_summaries/Black box tuning for language model as a service/summary.md
Chain-of-Thought Prompting Elicits Reasoning in Large Language Models,,2024,arXiv,,./LLMと逐次改善/article_summaries/Chain-of-Thought Prompting Elicits Reasoning in Large Language Models/summary.md
GEPA: Reflective Prompt Evolution Can Outperform Reinforcement Learning,,2025,arXiv,近年、大規模言語モデル（LLM）の推論能力を向上させるために、強化学習（RL）などの手法が盛んに研究されている。特にGRPO（Group Relative Policy Optimization）のような強化学習ベースのテスト時計算アプローチが注目を浴びている。 しかし、RLを用いた方策最適化は、膨大な数のロールアウトからの学習（サンプル効率の悪さ）や、スカラー報酬というスパースな信号に依存していることによる学習の難しさといった課題がある。,./LLMと逐次改善/article_summaries/GEPA: REFLECTIVE PROMPT EVOLUTION CAN OUTPERFORM REINFORCEMENT LEARNING/summary.md
"GrIPS: Gradient-free, Edit-based Instruction Search for Prompting Large Language Models",,2024,arXiv,"大規模言語モデル（LLM）に対して自然言語の指示（Instruction）をプロンプトとして与えることは、ゼロショット設定におけるタスク性能を向上させる上で有用なパラダイムである。従来、プロンプトの改善には人間による手動での書き換えや、勾配ベースのチューニングが用いられてきた。しかし、手動での書き換えには多大な時間と主観的な解釈が求められ、一方で勾配ベースのチューニングは大規模なモデルに対しては計算コストが膨大である上、APIベースのモデル（GPT-3など）には内部パラメータや勾配にアクセスできないため適用不可能である。こうした課題を解決するため、本論文では任意のAPIベース言語モデルに対しても適用可能でありながら、人間が読解可能な指示の形を維持しつつ性能を向上させ、勾配を用いない編集ベースの探索手法「GrIPS (Gradient-free, Edit-based Instruction Search for Prompting Large Language Models)」を提案している。","./LLMと逐次改善/article_summaries/GrIPS: Gradient-free, Edit-based Instruction Search for Prompting Large Language Models/summary.md"
Large Language Models Are Human-Level Prompt Engineers (APE),,2022,arXiv,大規模言語モデル（LLMs）は、自然言語の指示（プロンプト）を与えることで様々なタスクを汎用的に解くことができるが、その性能は与えられるプロンプトの質に大きく依存する。これまでは人間が手作業で試行錯誤しながらプロンプトを設計（プロンプトエンジニアリング）していたが、この探索空間は無限であり、どのプロンプトがモデルに最適かは人間には直感的に分かりにくいという課題があった。そこで本研究では、プロンプトの手動設計を脱却し、自然言語の指示を一つの「プログラム」と見立てて、LLM自身に最適な指示を自動生成・選択させるフレームワーク「Automatic Prompt Engineer (APE)」を提案している。,./LLMと逐次改善/article_summaries/Large Language Models Are Human-Level Prompt Engineers/summary.md
LARGE LANGUAGE MODELS AS OPTIMIZERS,,2023,arXiv,最適化（Optimization）は機械学習やオペレーションズ・リサーチをはじめとする多くの分野において不可欠であるが、勾配を持たない（derivative-free）最適化問題においては、探索空間や目的関数の性質に合わせて手作業でヒューリスティックな最適化手法を調整する必要があった。一方、近年発展が著しい大規模言語モデル（LLMs）は、高度な自然言語処理能力を持ち、コンテキスト内情報をゼロショットで理解し適応的な推論を行うことができる。 本研究では、このLLMを「ブラックボックス最適化器（Optimizer）」として直接活用する新しいフレームワーク「Optimization by PROmpting (OPRO)」を提案する。最適化問題を自然言語で記述することで、微細な数式やソルバーを構築することなく、迅速にタスクに適応し、解を探索・最適化することが可能となる。,./LLMと逐次改善/article_summaries/Large Language Models as Optimizers/summary.md
NATURAL LANGUAGE REINFORCEMENT LEARNING,,2024,arXiv,現在、AIエージェントは環境との継続的な相互作用を通じて学習する方向へ進化しているが、従来の強化学習 (RL) には課題があった。従来のRLでは、状態や行動の価値をスカラー値（数値）で表現・圧縮しているため、「なぜその行動の評価が高いのか / 低いのか」という理由（Why）をエージェント自身が深く理解できない。その結果、良い行動を偶然発見するまで試行錯誤を繰り返すだけの受動的なサンプリング（受動的な学習）にならざるを得ず、Reasoning（推論）能力があらかじめ備わっていない小規模モデル等では性能向上が難しい（Chain-of-Thought (CoT) の退化などが起こる）という問題があった。本研究は、この問題を解決し、エージェントが自ら理由を考えながら能動的かつ熟考的に学習（active and deliberative learning）できるフレームワークとして、Natural Language Reinforcement Learning (NLRL) を提案している。,./LLMと逐次改善/article_summaries/NATURAL LANGUAGE REINFORCEMENT LEARNING/summary.md
Promptbreeder: Self-Referential Self-Improvement Via Prompt Evolution,,2024,arXiv,LLM（大規模言語モデル）の推論能力を引き出す上で、Chain-of-Thought（CoT）などのプロンプト戦略は極めて有効です。しかし、これらのプロンプトは人間が手作業で設計（ハンドクラフト）しており、ドメインごとの最適なプロンプト設計には限界がありました。APE（Automatic Prompt Engineer）のようにプロンプトを自動生成・評価する先行研究は存在しますが、数世代の進化で品質が頭打ち（Diminishing Returns）になる課題がありました。本論文では、プロンプトの更新自体をLLMに行わせ、さらに「プロンプトを更新するためのプロンプト（変異プロンプト）」そのものも自己参照的に進化させることで、継続的かつドメインに適応した自己改善を実現する汎用フレームワーク「Promptbreeder（PB）」を提案しています。,./LLMと逐次改善/article_summaries/Promptbreeder: Self-Referential Self-Improvement Via Prompt Evolution/summary.md
REACT: SYNERGIZING REASONING AND ACTING IN LANGUAGE MODELS,,2022,arXiv,大規模言語モデル（LLM）は「Chain-of-Thought（CoT）」のような思考プロセス（Reasoning trace）を生成させる手法により推論能力を飛躍的に高めたが、外部環境へのアクセス（インタラクト）を持たないため知識が更新されず、事実誤認（Hallucination）や情報の欠如によるエラーが発生しやすい課題があった。 一方で、エージェントにとにかく行動（Action）の予測のみを行わせるアプローチは、環境からの情報は得られてもそれを言語的に保持・内省する推論プロセス（ワーキングメモリ等）を持たないため、複雑なタスクでの長期的計画の策定や予測外のエラーからの動的な復帰において困難を抱えていた。,./LLMと逐次改善/article_summaries/REACT: SYNERGIZING REASONING AND ACTING IN LANGUAGE MODELS/summary.md
RLPROMPT: Optimizing Discrete Text Prompts with Reinforcement Learning,,2021,arXiv,大規模言語モデル（LLMs）を用いたプロンプト学習において、離散的（Discrete）なテキストプロンプトの最適化は極めて重要であるものの、文字列という離散的な制約上、勾配を用いた最適化が困難であるという課題があった。これに対し、埋め込み（Embedding）を直接最適化する連続的（Soft）なプロンプトチューニングが主流となりつつあるが、「人間にとって解釈不能」「他モデルへの転移が困難」「LLMの内部勾配へのアクセスが必要（GPT-3のようなブラックボックスAPIでは使用不可）」といった問題があった。一方で、ヒューリスティックな検索（パラフレーズや手動調整）に基づく離散プロンプトの探索は、探索空間を体系的に網羅できず、安定性に欠ける。本論文ではこれらの課題を解決するため、LLMの勾配を必要とせず、強化学習（RL）を用いて最適化された離散プロンプトを生成するパラメータ効率の良いポリシーネットワーク「RLPrompt」を提案している。 *  【補足】言及されている代表的な先行研究アプローチまとめ  <details> <summary>1.,./LLMと逐次改善/article_summaries/RLPROMPT: OPTIMIZING DISCRETE TEXT PROMPTS WITH REINFORCEMENT LEARNING/summary.md
Reflection-Enhanced Meta-Optimization: Integrating TextGrad-style Prompt Optimization with Memory-Driven Self-Evolution,,2024,arXiv,TextGradのようなテキストベースの擬似勾配を用いたプロンプト最適化手法は、効果的でありながらLLMのパラメータ更新を必要としないという利点がある。しかし、多くの場合ステートレス（状態を持たない）であり、セッション間やタスク間で最適化の経験を蓄積・再利用する仕組みが存在しない。また、局所的な最適化に偏るため、トレーニングデータや初期プロンプトの特異な性質に対して過学習（Overfitting）を引き起こしやすく、未知のデータに対する汎化性能が極端に低下するという課題がある。本研究では、自己進化型のエージェントやRAG、Reflectionの考え方から着想を得て、局所的なプロンプトのチューニングと、長期的・大局的な最適化戦略を組み合わせた「Reflection-Enhanced Meta-Optimization (REMO)」を提案している。,./LLMと逐次改善/article_summaries/Reflection-Enhanced Meta-Optimization: Integrating TextGrad-style Prompt Optimization with Memory-Driven Self-Evolution/summary.md
summary,,2024,arXiv,大規模言語モデル（LLMs）は、目標駆動型エージェントとして外部環境（ゲーム、コンパイラ、APIなど）と対話するためにますます利用されるようになっています。しかし、従来の強化学習の手法では膨大な訓練サンプルや高コストなモデルの微調整が必要となるため、これらの言語エージェントが試行錯誤から迅速かつ効率的に学習することは依然として困難でした。この問題を解消するため、著者は重み（パラメータ）の更新ではなく「言語的フィードバック（Verbal Reinforcement）」を通じて言語エージェントを強化する新しいフレームワーク「Reflexion」を提案しました。この手法では、エージェントが環境からのタスクのフィードバックに基づいて言葉で「内省（Reflection）」し、その内省テキストをエピソード記憶バッファに保持して、その後の試行でより良い意思決定を促します。,./LLMと逐次改善/article_summaries/Reflexion: Language Agents with Verbal Reinforcement Learning/summary.md
Revolve: Optimizing AI Systems by Tracking Response Evolution in Textual Optimization,,2024,arXiv,大規模言語モデル（LLM）を用いたシステムの最適化において、プロンプトエンジニアリングやハイパーパラメータ調整を自動化する手法が注目されている。既存の自動化手法として、LLMによる自然言語フィードバックを勾配（Textual Gradient）に見立てて更新を行う手法（代表例：TextGrad）が存在する。 しかし、TextGradなどの手法は直近の出力フィードバックのみに依存する一階微分（First-order gradient）に相当する更新を行うため、微小な修正の繰り返しや一時的な変動に影響されやすく、最適化が停滞したり局所解に陥る（Local optimaに直面する）課題を抱えていた。,./LLMと逐次改善/article_summaries/Revolve: Optimizing AI Systems by Tracking Response Evolution in Textual Optimization/summary.md
Self-Consistency Improves Chain of Thought Reasoning in Language Models,,2024,arXiv,,./LLMと逐次改善/article_summaries/Self-Consistency Improves Chain of Thought Reasoning in Language Models/summary.md
TEMPERA: TEST-TIME PROMPT EDITING VIA REINFORCEMENT LEARNING,,2024,arXiv,大規模言語モデル（LLM）の発展に伴い、In-Context Learning（Few-Shotプロンプティング）が有望な手法として注目されている。しかし、言語モデルの性能は与えられるプロンプトの設計（命令の表現、少数ショットの例の選び方や順序など）に極めて敏感であり、タスクごとに最適なプロンプトを見つけるのは困難である。 従来のアプローチのうち、Soft Prompt Tuning（連続的なプロンプトの最適化）は勾配法を用いて最適化できるものの、生成されたベクトル空間のプロンプトは人間が解釈できない（Interpretableでない）という問題がある。また、Discrete Prompt Optimization（RLPromptなど）による探索は、タスク全体で固定のプロンプト（クエリに依存しないプロンプト）を出力するものが多く、テストケース（入力クエリ）ごとに柔軟にプロンプトを変更することができなかった。,./LLMと逐次改善/article_summaries/TEMPERA: TEST-TIME PROMPT EDITING VIA REINFORCEMENT LEARNING/summary.md
論文の背景,,2024,arXiv,,"./LLMと逐次改善/article_summaries/TextGrad: Automatic ""Differentiation"" via Text/summary.md"
TextualVerifier: Verify TextGrad Step-by-Step,,2024,arXiv,大規模言語モデル（LLMs）はゼロショット推論や数学的推論などの領域において目覚ましい成果を挙げているが、複雑な多段階推論において論理的な誤りを含むハルシネーション（幻覚）を起こしうる問題が課題となっている。これに対し、テキストベースの自動微分（Automatic Differentiation via Text）を用いてシステム全体の最適化を行う「TextGrad」という画期的なアプローチが提案されている。TextGradは自然言語フィードバックをテキストの勾配として用いることで、コーディングや推論の精度を大幅に向上させるが、それ自体には生成された推論過程の正しさを保証する「自己検証（self-verification）メカニズム」が統合されていない。 プロセスベースの報酬モデル（PRMs）など、多段階の推論結果を個別のステップ単位で検証するプロセス監視アプローチが有効であることは示されているものの、これまではTextGradによる最適化サイクルの中間ステップや最終出力を精密に検証する仕組みが存在せず、誤った推論を連鎖的に強化してしまうリスクがあった。本研究は、このTextGradの検証機能の欠如を解決するための、LLMを活用したテキストベースの検証システム「TextualVerifier」を提案したものである。,./LLMと逐次改善/article_summaries/TextualVerifier: Verify TextGrad Step-by-Step/summary.md
Tree of Thoughts: Deliberate Problem Solving with Large Language Models,,2024,arXiv,大語彙言語モデル（LLMs）は一般的な問題解決において目覚ましい成果を挙げているが、従来の推論プロセスはトークンレベルでの左から右への自己回帰的な生成（直感的な「System 1」モード）に依存している。これにより、探索や戦略的な先読みが必要な問題、あるいは初期の決定が後続の選択肢を大きく制限するような問題（数学的パズル、クロスワード等）では正答を導き出せないという課題があった。これに対し、人間の認知プロセスに見られる「System 2」のような、より意識的で意図的な計画プロセス（複数の選択肢を探索し、状態を自己評価しながら先増やバックトラックを行うプロセス）をLLMに組み込むため、本研究では新たな推論フレームワーク「Tree of Thoughts（ToT）」を考案。,./LLMと逐次改善/article_summaries/Tree of Thoughts: Deliberate Problem Solving with Large Language Models/summary.md
